{
  "$schema": "https://json-schema.org/draft/2020-12/schema",
  "$id": "https://schema.brandcontextprotocol.dev/v0.2/visual.json",
  "title": "Brand Context Protocol — visual.md",
  "description": "Schema for BCP visual.md daughter files. Defines structured fields for logos, color tokens, typography, imagery, composition, and motion. The v0.8 visual-semantics vocabulary is entirely optional and backward compatible.",
  "type": "object",
  "properties": {
    "bcp_version": {
      "type": "string",
      "enum": [
        "0.2",
        "0.3",
        "0.4",
        "0.5",
        "0.6",
        "0.7",
        "0.8"
      ]
    },
    "file_type": {
      "type": "string",
      "const": "visual"
    },
    "parent": {
      "type": "string",
      "description": "Path of the root file, typically /.well-known/brand.md"
    },
    "last_updated": {
      "type": "string",
      "format": "date"
    },
    "logo": {
      "type": "object",
      "description": "Map of named logo entries. The key is the stable identifier an agent uses to reference this logo (e.g., 'primary', 'icon', 'app_icon').",
      "additionalProperties": {
        "$ref": "#/$defs/logoEntry"
      }
    },
    "logo_usage": {
      "type": "object",
      "description": "Rules governing how any logo entry may be displayed.",
      "properties": {
        "clear_space": {
          "$ref": "#/$defs/clearSpace"
        },
        "minimum_size": {
          "$ref": "#/$defs/minimumSize"
        },
        "approved_backgrounds": {
          "type": "array",
          "items": {
            "$ref": "#/$defs/backgroundRule"
          }
        },
        "forbidden_backgrounds": {
          "type": "array",
          "items": {
            "$ref": "#/$defs/backgroundRule"
          }
        },
        "forbidden_modifications": {
          "type": "array",
          "items": {
            "type": "string"
          },
          "description": "Binding list of modifications no agent may apply. Common entries: stretch, rotate, recolor, drop_shadow, glow, outline, crop, container_shape, animate."
        },
        "generation_policy": {
          "type": "string",
          "enum": [
            "official_assets_only",
            "generation_permitted"
          ],
          "description": "Whether a consumer may generate a logo approximation. If absent, consumers SHOULD prefer verified official assets."
        },
        "generation_instructions": {
          "type": "array",
          "items": {
            "type": "string"
          }
        },
        "evidence_status": {
          "$ref": "#/$defs/evidenceStatus"
        }
      }
    },
    "color": {
      "type": "object",
      "description": "Semantic color tokens. Keys are role names; values define the token.",
      "properties": {
        "tokens": {
          "type": "object",
          "additionalProperties": {
            "$ref": "#/$defs/colorToken"
          }
        },
        "approved_pairs": {
          "type": "array",
          "description": "Allowed foreground/background token combinations.",
          "items": {
            "type": "object",
            "properties": {
              "foreground": {
                "type": "string"
              },
              "background": {
                "type": "string"
              },
              "context": {
                "type": "string",
                "description": "Optional human-readable note on when this pairing applies."
              }
            },
            "required": [
              "foreground",
              "background"
            ]
          }
        },
        "forbidden_pairs": {
          "type": "array",
          "items": {
            "type": "object",
            "properties": {
              "foreground": {
                "type": "string"
              },
              "background": {
                "type": "string"
              },
              "reason": {
                "type": "string"
              }
            },
            "required": [
              "foreground",
              "background"
            ]
          }
        }
      }
    },
    "typography": {
      "type": "object",
      "properties": {
        "families": {
          "type": "object",
          "description": "Map of typeface entries. Keys are stable IDs ('display', 'body', 'mono').",
          "additionalProperties": {
            "$ref": "#/$defs/typefaceFamily"
          }
        },
        "roles": {
          "type": "object",
          "description": "Map of usage roles to family IDs. Roles include: display, body, ui, mono, code.",
          "additionalProperties": {
            "type": "string",
            "description": "Family ID from the families map."
          }
        }
      }
    },
    "layout": {
      "$ref": "#/$defs/compositionGuidance"
    },
    "composition": {
      "$ref": "#/$defs/compositionGuidance",
      "description": "Optional brand-level composition semantics. Implementation tokens and component mechanics belong in DESIGN.md."
    },
    "imagery": {
      "type": "object",
      "description": "Principles and optional structured semantics for photographic, illustrative, video, audio, and other approved media.",
      "properties": {
        "photographic_style": {
          "type": "string"
        },
        "illustration_style": {
          "type": "string"
        },
        "iconography_style": {
          "type": "string"
        },
        "forbidden_treatments": {
          "type": "array",
          "items": {
            "type": "string"
          }
        },
        "photography": {
          "$ref": "#/$defs/mediaDirection"
        },
        "illustration": {
          "$ref": "#/$defs/mediaDirection"
        },
        "video": {
          "$ref": "#/$defs/mediaDirection"
        },
        "audio": {
          "$ref": "#/$defs/mediaDirection"
        },
        "prompt_fragments": {
          "type": "array",
          "items": {
            "type": "string"
          }
        },
        "negative_prompts": {
          "type": "array",
          "items": {
            "type": "string"
          }
        },
        "evidence_status": {
          "$ref": "#/$defs/evidenceStatus"
        }
      }
    },
    "motion": {
      "type": "object",
      "description": "Brand-level motion character and constraints. Exact timings, easing curves, and component transitions belong in DESIGN.md.",
      "properties": {
        "character": {
          "type": "array",
          "items": {
            "type": "string"
          }
        },
        "principles": {
          "type": "array",
          "items": {
            "type": "string"
          }
        },
        "forbidden_treatments": {
          "type": "array",
          "items": {
            "type": "string"
          }
        },
        "reduced_motion_policy": {
          "type": "string"
        },
        "evidence_status": {
          "$ref": "#/$defs/evidenceStatus"
        }
      }
    },
    "canonical_tokens": {
      "type": "array",
      "description": "Lossless deterministic projection of bcp.canonical.visual-tokens.v1 records when explicitly enabled by manifest canonical_model. Records are sorted by stable ID using UTF-8 byte order.",
      "items": {
        "$ref": "../canonical-visual-tokens.schema.json#/$defs/token"
      }
    },
    "extensions": {
      "type": "object",
      "description": "Brand-specific or vendor-specific fields not covered by the core schema. Consumers MUST ignore extension fields they do not recognize.",
      "additionalProperties": true
    }
  },
  "required": [
    "bcp_version",
    "file_type",
    "parent",
    "last_updated"
  ],
  "$defs": {
    "evidenceStatus": {
      "type": "string",
      "enum": [
        "brand_declared",
        "brand_confirmed",
        "observed",
        "inferred"
      ],
      "description": "Authority of the visual guidance. Inferred values MUST NOT be represented as binding brand truth."
    },
    "logoEntry": {
      "type": "object",
      "properties": {
        "description": {
          "type": "string",
          "description": "Human-readable description of when this logo is used."
        },
        "active_through": {
          "type": "string",
          "format": "date",
          "description": "Optional sunset date. After this date, consumers SHOULD fall back to the entry named in 'fallback'."
        },
        "fallback": {
          "type": "string",
          "description": "Optional ID of another logo entry to use after active_through expires."
        },
        "variants": {
          "type": "array",
          "minItems": 1,
          "items": {
            "$ref": "#/$defs/logoVariant"
          }
        }
      },
      "required": [
        "variants"
      ]
    },
    "logoVariant": {
      "type": "object",
      "properties": {
        "format": {
          "type": "string",
          "enum": [
            "svg",
            "png",
            "jpg",
            "webp",
            "avif",
            "pdf",
            "eps"
          ]
        },
        "url": {
          "type": "string",
          "format": "uri",
          "pattern": "^https://",
          "description": "HTTPS URL where the asset is served. HTTP is not permitted."
        },
        "sha256": {
          "type": "string",
          "pattern": "^[a-f0-9]{64}$",
          "description": "Lowercase SHA-256 hash of the asset bytes. REQUIRED so consumers can verify integrity."
        },
        "width": {
          "type": "integer",
          "minimum": 1
        },
        "height": {
          "type": "integer",
          "minimum": 1
        },
        "background": {
          "type": "string",
          "description": "Background type or color this variant is designed against (e.g., 'transparent', 'white', 'brand-primary')."
        },
        "treatment": {
          "type": "string",
          "description": "Treatment applied to this variant (e.g., 'white-fill', 'monochrome', 'embossed')."
        },
        "purpose": {
          "type": "string",
          "description": "Free-form description of when an agent should select this variant."
        }
      },
      "required": [
        "format",
        "url",
        "sha256"
      ]
    },
    "clearSpace": {
      "type": "object",
      "properties": {
        "rule": {
          "type": "string",
          "description": "Human-readable clear-space rule."
        },
        "machine_value": {
          "type": "object",
          "properties": {
            "unit": {
              "type": "string",
              "enum": [
                "x-height",
                "cap-height",
                "logo-height",
                "logo-width",
                "px",
                "em",
                "rem"
              ]
            },
            "multiplier": {
              "type": "number",
              "minimum": 0
            }
          },
          "required": [
            "unit",
            "multiplier"
          ]
        }
      }
    },
    "minimumSize": {
      "type": "object",
      "properties": {
        "digital_px": {
          "type": "integer",
          "minimum": 1
        },
        "print_in": {
          "type": "number",
          "minimum": 0
        },
        "print_mm": {
          "type": "number",
          "minimum": 0
        }
      }
    },
    "backgroundRule": {
      "type": "object",
      "properties": {
        "type": {
          "type": "string",
          "enum": [
            "solid_color",
            "gradient",
            "photographic",
            "transparent",
            "patterned"
          ]
        },
        "color_token": {
          "type": "string",
          "description": "Reference to a token name from color.tokens. Applies when type is solid_color."
        },
        "min_contrast_ratio": {
          "type": "number",
          "description": "WCAG contrast ratio required for this background. Applies when type is photographic."
        },
        "note": {
          "type": "string"
        }
      },
      "required": [
        "type"
      ]
    },
    "colorToken": {
      "type": "object",
      "properties": {
        "hex": {
          "type": "string",
          "pattern": "^#([0-9A-Fa-f]{3}|[0-9A-Fa-f]{6}|[0-9A-Fa-f]{8})$"
        },
        "role": {
          "type": "string",
          "enum": [
            "primary",
            "secondary",
            "accent",
            "surface",
            "surface-inverse",
            "text",
            "text-inverse",
            "critical",
            "success",
            "warning",
            "info",
            "neutral"
          ]
        },
        "description": {
          "type": "string"
        },
        "semantic_name": {
          "type": "string"
        },
        "perceptual_descriptors": {
          "type": "array",
          "items": {
            "type": "string"
          }
        },
        "generation_prompt": {
          "type": "string"
        },
        "avoid_confusion_with": {
          "type": "array",
          "items": {
            "type": "string"
          }
        },
        "usage_rule": {
          "type": "string"
        },
        "evidence_status": {
          "$ref": "#/$defs/evidenceStatus"
        }
      },
      "required": [
        "hex",
        "role"
      ]
    },
    "typefaceFamily": {
      "type": "object",
      "properties": {
        "family": {
          "type": "string",
          "description": "CSS family name."
        },
        "fallback_stack": {
          "type": "array",
          "items": {
            "type": "string"
          },
          "description": "CSS fallback stack in priority order."
        },
        "weights": {
          "type": "array",
          "items": {
            "type": "integer",
            "minimum": 1,
            "maximum": 1000
          }
        },
        "styles": {
          "type": "array",
          "items": {
            "type": "string",
            "enum": [
              "normal",
              "italic",
              "oblique"
            ]
          }
        },
        "source": {
          "type": "string",
          "description": "Where the typeface is licensed from (e.g., 'Adobe Fonts', 'Google Fonts', 'self-hosted')."
        },
        "license_note": {
          "type": "string"
        },
        "classification": {
          "type": "string"
        },
        "character": {
          "type": "array",
          "items": {
            "type": "string"
          }
        },
        "comparable_families": {
          "type": "array",
          "items": {
            "type": "string"
          },
          "description": "Families with visual similarity. This does not grant licensing rights or authorize substitution."
        },
        "usage_rule": {
          "type": "string"
        },
        "evidence_status": {
          "$ref": "#/$defs/evidenceStatus"
        }
      },
      "required": [
        "family"
      ]
    },
    "compositionGuidance": {
      "type": "object",
      "properties": {
        "density": {
          "type": "string"
        },
        "whitespace": {
          "type": "string"
        },
        "grid": {
          "type": "string"
        },
        "hierarchy": {
          "type": "string"
        },
        "cropping": {
          "type": "string"
        },
        "corner_radius": {
          "type": "string"
        },
        "forbidden_compositions": {
          "type": "array",
          "items": {
            "type": "string"
          }
        },
        "evidence_status": {
          "$ref": "#/$defs/evidenceStatus"
        }
      }
    },
    "mediaDirection": {
      "type": "object",
      "properties": {
        "camera_language": {
          "type": "string"
        },
        "lighting": {
          "type": "string"
        },
        "composition": {
          "type": "array",
          "items": {
            "type": "string"
          }
        },
        "color_grade": {
          "type": "string"
        },
        "subject_behavior": {
          "type": "array",
          "items": {
            "type": "string"
          }
        },
        "principles": {
          "type": "array",
          "items": {
            "type": "string"
          }
        },
        "prompt_fragments": {
          "type": "array",
          "items": {
            "type": "string"
          }
        },
        "forbidden_treatments": {
          "type": "array",
          "items": {
            "type": "string"
          }
        },
        "negative_prompts": {
          "type": "array",
          "items": {
            "type": "string"
          }
        },
        "evidence_status": {
          "$ref": "#/$defs/evidenceStatus"
        }
      }
    }
  }
}
